{
  "artifact": "RUN_RESULT",
  "schema_version": "fitflow-run-result/v2",
  "task_id": "FF-FIX-001",
  "run_id": "FF-FIX-001-20260825-01",
  "created_at": "2026-08-25T16:19:26-03:00",
  "baseline": {
    "revision": "78aaa3082d079f39a2bd8da015cc165a81b5cc20",
    "fingerprint_status": "unavailable",
    "working_tree_fingerprint": null,
    "fingerprint_reason": "Resultado consolidado sobre branch fix/FF-FIX-001-session-contract con implementacion y evidencia previas al commit de integracion."
  },
  "status": "COMPLETED",
  "current_state": "PENDING_ACCEPTANCE",
  "acceptance_criteria": [
    {"id": "AC-1", "status": "PASS", "evidence": "import app.main exit 0; 91 rutas."},
    {"id": "AC-2", "status": "PASS", "evidence": "fitflow_test en e4f5a6b7c8d9; users y gym_classes presentes."},
    {"id": "AC-3", "status": "PASS", "evidence": "test_rrule_generation.py 2 passed sobre DB real; primera vez verdes."},
    {"id": "AC-4", "status": "PASS", "evidence": "Suite completa 48 passed, 0 failed (baseline 38 passed / 6 failed)."},
    {"id": "AC-5", "status": "PASS", "evidence": "4 unit tests nuevos de occupancy/next-session con snapshot int."},
    {"id": "AC-6", "status": "FAIL", "evidence": "Pyright scope 0 errores; Ruff conserva 16 hallazgos legacy en lineas no modificadas de archivos propios (EXE002/I001/RUF100/DTZ011/F401); cero atribuibles al diff."},
    {"id": "AC-7", "status": "PASS", "evidence": "Diff en ownership keys (enmienda del unit test documentada); alembic heads intacto e4f5a6b7c8d9."},
    {"id": "AC-8", "status": "PASS", "evidence": "Validator determinista + Reviewer independiente verdict PASS sin bloqueantes."}
  ],
  "artifacts": [
    {
      "path": ".ai/runs/FF-FIX-001-20260825-01/validation.json",
      "hash": "sha256:2f6c4510840a84f7011f3e404953497895bb0069c8bf2c791c6508465b23b796",
      "schema_version": "fitflow-validation-result/v2"
    },
    {
      "path": ".ai/runs/FF-FIX-001-20260825-01/review.json",
      "hash": "sha256:b50fcb620ecf87f325c285b1e4ecdeaaf0116284ced281e619736222b0ab67e7",
      "schema_version": "fitflow-review-result/v2"
    }
  ],
  "risks": [
    "Wrapper canonico permanece FAIL por deuda global Ruff 275-276 y Pyright 29; naturaleza identica al baseline, Pyright mejora por el fix int.",
    "Sin cobertura HTTP end-to-end dirigida de POST create / PUT regenerate (suite MVP HTTP heredada NOT_RUN)."
  ],
  "developer_decisions_required": [
    "Aceptar o rechazar FF-FIX-001 con AC-6 fallando solo por lint legacy preexistente en lineas no tocadas.",
    "Integrar la branch solo tras aceptacion explicita y promover a DONE exclusivamente como Developer."
  ],
  "finops_summary_ref": null
}
