{
  "artifact": "RUN_RESULT",
  "schema_version": "fitflow-run-result/v2",
  "task_id": "FF-AI-VNEXT-003",
  "run_id": "FF-AI-VNEXT-003-20260818",
  "created_at": "2026-08-18T17:10:00-03:00",
  "baseline": {
    "revision": "44952257482192c438cb38f80be623056fce2409",
    "fingerprint_status": "unavailable",
    "working_tree_fingerprint": null,
    "fingerprint_reason": "El arbol contiene cambios de la migracion vNext en curso; no se capturo un fingerprint antes de la tarea."
  },
  "status": "COMPLETED",
  "current_state": "PENDING_ACCEPTANCE",
  "acceptance_criteria": [
    {"id": "AC-1", "status": "PASS", "evidence": "tests/contract/contracts.test.js -> 8 PASS"},
    {"id": "AC-2", "status": "PASS", "evidence": "tests/contract/registries.test.js -> 8 PASS contra ../.ai/config"},
    {"id": "AC-3", "status": "PASS", "evidence": "guard zod: DONE requiere PENDING_ACCEPTANCE + developer + DEVELOPER_DECISION"},
    {"id": "AC-4", "status": "PASS", "evidence": "../FitFlow-ai/package.json declara zod y yaml"}
  ],
  "artifacts": [
    {
      "path": ".ai/runs/FF-AI-VNEXT-003-20260818/validation.json",
      "hash": "sha256:a270d988a80805d66a2845ee89c8a522e61f1b1a694128365aadf21b54cc057f",
      "schema_version": "fitflow-validation-result/v2"
    },
    {
      "path": ".ai/runs/FF-AI-VNEXT-003-20260818/review.json",
      "hash": "sha256:9cfabee026f2f5268b6b66eeee3367fc5a61345d12728fa443bdd8d850f2e2ac",
      "schema_version": "fitflow-review-result/v2"
    }
  ],
  "risks": [
    "Schema finops usa la version v1 real del yaml; si se migra a v2 hay que actualizar el schema.",
    "zod y yaml fueron instalados con autorizacion explicita; quedan registrados en ../FitFlow-ai/package.json."
  ],
  "developer_decisions_required": [
    "Aceptar contracts/registries v2 para iniciar State Machine y Run Store (FF-AI-VNEXT-004)."
  ],
  "finops_summary_ref": null
}