{
  "artifact": "RUN_RESULT",
  "schema_version": "fitflow-run-result/v2",
  "task_id": "FF-AI-VNEXT-004",
  "run_id": "FF-AI-VNEXT-004-20260818",
  "created_at": "2026-08-18T18:30:00-03:00",
  "baseline": {
    "revision": "44952257482192c438cb38f80be623056fce2409",
    "fingerprint_status": "unavailable",
    "working_tree_fingerprint": null,
    "fingerprint_reason": "El arbol contiene cambios de la migracion vNext en curso; no se capturo un fingerprint antes de la tarea."
  },
  "status": "COMPLETED",
  "current_state": "PENDING_ACCEPTANCE",
  "acceptance_criteria": [
    {"id": "AC-1", "status": "PASS", "evidence": "tests/core/state-machine.test.js -> 8 PASS contra orchestrator.yaml real"},
    {"id": "AC-2", "status": "PASS", "evidence": "guard: DONE exige PENDING_ACCEPTANCE + developer (rechaza reviewer y otros orígenes)"},
    {"id": "AC-3", "status": "PASS", "evidence": "RunStore escribe events.jsonl y run-state.json; tests PASS"},
    {"id": "AC-4", "status": "PASS", "evidence": "SqliteProjection consulta latestState/eventsFor; tests PASS"}
  ],
  "artifacts": [
    {
      "path": ".ai/runs/FF-AI-VNEXT-004-20260818/validation.json",
      "hash": "sha256:f43011efc685e5c2926d1efb4f0ed95f5af2cd9b42a4a5aab134d9388298676e",
      "schema_version": "fitflow-validation-result/v2"
    },
    {
      "path": ".ai/runs/FF-AI-VNEXT-004-20260818/review.json",
      "hash": "sha256:cf98de5ab44019fa59d03c69f2043c8b9a5b3cdc2d83e63accca0a187b4a7bca",
      "schema_version": "fitflow-review-result/v2"
    }
  ],
  "risks": [
    "better-sqlite3 depende de un binario nativo; sin aprobar install-scripts el rebuild falla en CI nuevo (el binario precargado funciona).",
    "La proyeccion SQLite no valida monotonia de sequence; es derived y events.jsonl sigue siendo canonical."
  ],
  "developer_decisions_required": [
    "Aceptar nucleo (State Machine + Run Store) para construir Router y Model Resolver (FF-AI-VNEXT-005).",
    "Decidir si se autoriza el install-script de better-sqlite3 para entornos CI."
  ],
  "finops_summary_ref": null
}