{
  "artifact": "RUN_RESULT",
  "schema_version": "fitflow-run-result/v2",
  "task_id": "FF-AI-VNEXT-002",
  "run_id": "FF-AI-VNEXT-002-20260818",
  "created_at": "2026-08-18T16:30:00-03:00",
  "baseline": {
    "revision": "44952257482192c438cb38f80be623056fce2409",
    "fingerprint_status": "unavailable",
    "working_tree_fingerprint": null,
    "fingerprint_reason": "El arbol contiene cambios de la migracion vNext en curso; no se capturo un fingerprint antes de la tarea."
  },
  "status": "COMPLETED",
  "current_state": "PENDING_ACCEPTANCE",
  "acceptance_criteria": [
    {"id": "AC-1", "status": "PASS", "evidence": "node --test tests/*.test.js -> 6 PASS"},
    {"id": "AC-2", "status": "PASS", "evidence": "ffai-doctor reporta 8 herramientas requeridas AVAILABLE"},
    {"id": "AC-3", "status": "PASS", "evidence": "repo-packager y project-profile AVAILABLE; libreoffice UNREACHABLE documentado"},
    {"id": "AC-4", "status": "PASS", "evidence": "node bin/ffai-doctor.js -> exit 0"},
    {"id": "AC-5", "status": "PASS", "evidence": "../FitFlow-ai/ presente en el arbol con AGENTS.md, docs y scripts/doctor"}
  ],
  "artifacts": [
    {
      "path": ".ai/runs/FF-AI-VNEXT-002-20260818/validation.json",
      "hash": "sha256:8d0383baaf8a6a49194bb207666f3dc0f9bf0d6aa37538e5107dbd9dcd3dc4a6",
      "schema_version": "fitflow-validation-result/v2"
    },
    {
      "path": ".ai/runs/FF-AI-VNEXT-002-20260818/review.json",
      "hash": "sha256:313cdbe4054bec8a4ae6cd72626a7ea929772bd25ffa4f25610e84e9a3d7100f",
      "schema_version": "fitflow-review-result/v2"
    }
  ],
  "risks": [
    "LibreOffice queda UNREACHABLE sin soffice en PATH; solo afecta render DOCX, fuera del gate de esta tarea.",
    "npm.cmd en Program Files requiere citado en shell; cubierto por tests."
  ],
  "developer_decisions_required": [
    "Aceptar el doctor FF-AI-VNEXT-002 para iniciar contracts/registries v2 (FF-AI-VNEXT-003)."
  ],
  "finops_summary_ref": null
}